<!ELEMENT portal (resource+)>

<!ELEMENT resource (name, description)>

<!ATTLIST resource
    id ID #REQUIRED
>

<!ELEMENT name (#PCDATA)>

<!ELEMENT description (#PCDATA)>
